{
  "eventId": "70000000-0000-0000-0000-000000000007",
  "eventType": "ROLE_UNASSIGNED",
  "eventVersion": 2,
  "sourceSeverity": "WARNING",
  "workspaceId": "10000000-0000-0000-0000-000000000008",
  "seasonId": "20000000-0000-0000-0000-000000000008",
  "sourceReference": "baton-continuity:60000000-0000-0000-0000-000000000001",
  "aggregateRevision": 3,
  "occurredAt": "2026-08-22T11:00:00Z",
  "state": "RESOLVED"
}
