{
  "eventId": "70000000-0000-0000-0000-000000000004",
  "eventType": "ROUTINE_REPEATEDLY_OVERDUE",
  "eventVersion": 2,
  "sourceSeverity": "CRITICAL",
  "workspaceId": "10000000-0000-0000-0000-000000000008",
  "seasonId": "20000000-0000-0000-0000-000000000008",
  "sourceReference": "baton-continuity:60000000-0000-0000-0000-000000000004",
  "aggregateRevision": 1,
  "occurredAt": "2026-08-22T09:00:00Z",
  "state": "ACTIVE"
}
